### Starting TaskPrologue of job 1391819 on tg097 at Mon Nov 17 02:32:26 PM CET 2025
Running on cores 64-95 with governor ondemand
Mon Nov 17 14:32:26 2025       
+-----------------------------------------------------------------------------------------+
| NVIDIA-SMI 580.95.05              Driver Version: 580.95.05      CUDA Version: 13.0     |
+-----------------------------------------+------------------------+----------------------+
| GPU  Name                 Persistence-M | Bus-Id          Disp.A | Volatile Uncorr. ECC |
| Fan  Temp   Perf          Pwr:Usage/Cap |           Memory-Usage | GPU-Util  Compute M. |
|                                         |                        |               MIG M. |
|=========================================+========================+======================|
|   0  NVIDIA A100-SXM4-40GB          On  |   00000000:81:00.0 Off |                    0 |
| N/A   36C    P0             53W /  400W |       0MiB /  40960MiB |      0%      Default |
|                                         |                        |             Disabled |
+-----------------------------------------+------------------------+----------------------+

+-----------------------------------------------------------------------------------------+
| Processes:                                                                              |
|  GPU   GI   CI              PID   Type   Process name                        GPU Memory |
|        ID   ID                                                               Usage      |
|=========================================================================================|
|  No running processes found                                                             |
+-----------------------------------------------------------------------------------------+
### Finished TaskPrologue

🦥 Unsloth: Will patch your computer to enable 2x faster free finetuning.
🦥 Unsloth Zoo will now patch everything to make training faster!
Created run directory: /home/vault/iwi5/iwi5298h/models_image_text/gemma/inventory_dataset/run_A100_CER_20251117_143251

============================================================
GEMMA-3 INVENTORY - A100 OPTIMIZED + OPTIONAL AUGMENTATION
============================================================
Loading Gemma-3 vision model with Unsloth for INVENTORY...
Temporary directory for augmented images: /tmp/1391819.tinygpu/inventory_gemma_aug_amfmzaqf
Augmentation factor (per original image): 1
Clearing Unsloth compiled cache: /home/hpc/iwi5/iwi5298h/Uddipan-Thesis/gemma3/unsloth_compiled_cache
Unsloth: WARNING `trust_remote_code` is True.
Are you certain you want to do remote code execution?
==((====))==  Unsloth 2025.7.3: Fast Gemma3 patching. Transformers: 4.51.3.
   \\   /|    NVIDIA A100-SXM4-40GB. Num GPUs = 1. Max memory: 39.494 GB. Platform: Linux.
O^O/ \_/ \    Torch: 2.7.1+cu126. CUDA: 8.0. CUDA Toolkit: 12.6. Triton: 3.3.1
\        /    Bfloat16 = TRUE. FA [Xformers = 0.0.31.post1. FA2 = False]
 "-____-"     Free license: http://github.com/unslothai/unsloth
Unsloth: Fast downloading is enabled - ignore downloading bars which are red colored!
Unsloth: Gemma3 does not support SDPA - switching to eager!
Model loaded - Unsloth auto-configured dtype and attention
Unsloth: Making `base_model.model.vision_tower.vision_model` require gradients
Gemma-3 vision model loaded with A100-optimized LoRA config

============================================================
STARTING TRAINING (A100-OPTIMIZED, INVENTORY)
============================================================
Preparing training and validation datasets for INVENTORY...
Preparing INVENTORY TRAIN data with augmentation factor = 1
  Augmenting [1/213] inventarbuch-265.jpg (1/1)
  Augmenting [2/213] inventarbuch-189.jpg (1/1)
  Augmenting [3/213] inventarbuch-026.jpg (1/1)
  Augmenting [4/213] inventarbuch-021.jpg (1/1)
  Augmenting [5/213] inventarbuch-281.jpg (1/1)
  Augmenting [6/213] inventarbuch-167.jpg (1/1)
  Augmenting [7/213] inventarbuch-280.jpg (1/1)
  Augmenting [8/213] inventarbuch-057.jpg (1/1)
  Augmenting [9/213] inventarbuch-159.jpg (1/1)
  Augmenting [10/213] inventarbuch-094.jpg (1/1)
  Augmenting [11/213] inventarbuch-040.jpg (1/1)
  Augmenting [12/213] inventarbuch-305.jpg (1/1)
  Augmenting [13/213] inventarbuch-220.jpg (1/1)
  Augmenting [14/213] inventarbuch-226.jpg (1/1)
  Augmenting [15/213] inventarbuch-264.jpg (1/1)
  Augmenting [16/213] inventarbuch-089.jpg (1/1)
  Augmenting [17/213] inventarbuch-002.jpg (1/1)
  Augmenting [18/213] inventarbuch-290.jpg (1/1)
  Augmenting [19/213] inventarbuch-109.jpg (1/1)
  Augmenting [20/213] inventarbuch-144.jpg (1/1)
  Augmenting [21/213] inventarbuch-075.jpg (1/1)
  Augmenting [22/213] inventarbuch-239.jpg (1/1)
  Augmenting [23/213] inventarbuch-145.jpg (1/1)
  Augmenting [24/213] inventarbuch-091.jpg (1/1)
  Augmenting [25/213] inventarbuch-007.jpg (1/1)
  Augmenting [26/213] inventarbuch-285.jpg (1/1)
  Augmenting [27/213] inventarbuch-247.jpg (1/1)
  Augmenting [28/213] inventarbuch-117.jpg (1/1)
  Augmenting [29/213] inventarbuch-288.jpg (1/1)
  Augmenting [30/213] inventarbuch-050.jpg (1/1)
  Augmenting [31/213] inventarbuch-063.jpg (1/1)
  Augmenting [32/213] inventarbuch-249.jpg (1/1)
  Augmenting [33/213] inventarbuch-204.jpg (1/1)
  Augmenting [34/213] inventarbuch-172.jpg (1/1)
  Augmenting [35/213] inventarbuch-088.jpg (1/1)
  Augmenting [36/213] inventarbuch-039.jpg (1/1)
  Augmenting [37/213] inventarbuch-300.jpg (1/1)
  Augmenting [38/213] inventarbuch-286.jpg (1/1)
  Augmenting [39/213] inventarbuch-192.jpg (1/1)
  Augmenting [40/213] inventarbuch-085.jpg (1/1)
  Augmenting [41/213] inventarbuch-241.jpg (1/1)
  Augmenting [42/213] inventarbuch-270.jpg (1/1)
  Augmenting [43/213] inventarbuch-180.jpg (1/1)
  Augmenting [44/213] inventarbuch-202.jpg (1/1)
  Augmenting [45/213] inventarbuch-140.jpg (1/1)
  Augmenting [46/213] inventarbuch-008.jpg (1/1)
  Augmenting [47/213] inventarbuch-258.jpg (1/1)
  Augmenting [48/213] inventarbuch-028.jpg (1/1)
  Augmenting [49/213] inventarbuch-209.jpg (1/1)
  Augmenting [50/213] inventarbuch-228.jpg (1/1)
  Augmenting [51/213] inventarbuch-306.jpg (1/1)
  Augmenting [52/213] inventarbuch-277.jpg (1/1)
  Augmenting [53/213] inventarbuch-184.jpg (1/1)
  Augmenting [54/213] inventarbuch-289.jpg (1/1)
  Augmenting [55/213] inventarbuch-067.jpg (1/1)
  Augmenting [56/213] inventarbuch-036.jpg (1/1)
  Augmenting [57/213] inventarbuch-292.jpg (1/1)
  Augmenting [58/213] inventarbuch-092.jpg (1/1)
  Augmenting [59/213] inventarbuch-231.jpg (1/1)
  Augmenting [60/213] inventarbuch-246.jpg (1/1)
  Augmenting [61/213] inventarbuch-081.jpg (1/1)
  Augmenting [62/213] inventarbuch-034.jpg (1/1)
  Augmenting [63/213] inventarbuch-175.jpg (1/1)
  Augmenting [64/213] inventarbuch-044.jpg (1/1)
  Augmenting [65/213] inventarbuch-006.jpg (1/1)
  Augmenting [66/213] inventarbuch-154.jpg (1/1)
  Augmenting [67/213] inventarbuch-234.jpg (1/1)
  Augmenting [68/213] inventarbuch-111.jpg (1/1)
  Augmenting [69/213] inventarbuch-011.jpg (1/1)
  Augmenting [70/213] inventarbuch-126.jpg (1/1)
  Augmenting [71/213] inventarbuch-157.jpg (1/1)
  Augmenting [72/213] inventarbuch-152.jpg (1/1)
  Augmenting [73/213] inventarbuch-190.jpg (1/1)
  Augmenting [74/213] inventarbuch-304.jpg (1/1)
  Augmenting [75/213] inventarbuch-217.jpg (1/1)
  Augmenting [76/213] inventarbuch-103.jpg (1/1)
  Augmenting [77/213] inventarbuch-207.jpg (1/1)
  Augmenting [78/213] inventarbuch-267.jpg (1/1)
  Augmenting [79/213] inventarbuch-297.jpg (1/1)
  Augmenting [80/213] inventarbuch-308.jpg (1/1)
  Augmenting [81/213] inventarbuch-068.jpg (1/1)
  Augmenting [82/213] inventarbuch-259.jpg (1/1)
  Augmenting [83/213] inventarbuch-276.jpg (1/1)
  Augmenting [84/213] inventarbuch-053.jpg (1/1)
  Augmenting [85/213] inventarbuch-269.jpg (1/1)
  Augmenting [86/213] inventarbuch-236.jpg (1/1)
  Augmenting [87/213] inventarbuch-129.jpg (1/1)
  Augmenting [88/213] inventarbuch-138.jpg (1/1)
  Augmenting [89/213] inventarbuch-193.jpg (1/1)
  Augmenting [90/213] inventarbuch-080.jpg (1/1)
  Augmenting [91/213] inventarbuch-125.jpg (1/1)
  Augmenting [92/213] inventarbuch-035.jpg (1/1)
  Augmenting [93/213] inventarbuch-023.jpg (1/1)
  Augmenting [94/213] inventarbuch-072.jpg (1/1)
  Augmenting [95/213] inventarbuch-062.jpg (1/1)
  Augmenting [96/213] inventarbuch-087.jpg (1/1)
  Augmenting [97/213] inventarbuch-128.jpg (1/1)
  Augmenting [98/213] inventarbuch-160.jpg (1/1)
  Augmenting [99/213] inventarbuch-150.jpg (1/1)
  Augmenting [100/213] inventarbuch-218.jpg (1/1)
  Augmenting [101/213] inventarbuch-201.jpg (1/1)
  Augmenting [102/213] inventarbuch-119.jpg (1/1)
  Augmenting [103/213] inventarbuch-237.jpg (1/1)
  Augmenting [104/213] inventarbuch-108.jpg (1/1)
  Augmenting [105/213] inventarbuch-012.jpg (1/1)
  Augmenting [106/213] inventarbuch-074.jpg (1/1)
  Augmenting [107/213] inventarbuch-162.jpg (1/1)
  Augmenting [108/213] inventarbuch-009.jpg (1/1)
  Augmenting [109/213] inventarbuch-032.jpg (1/1)
  Augmenting [110/213] inventarbuch-156.jpg (1/1)
  Augmenting [111/213] inventarbuch-106.jpg (1/1)
  Augmenting [112/213] inventarbuch-110.jpg (1/1)
  Augmenting [113/213] inventarbuch-048.jpg (1/1)
  Augmenting [114/213] inventarbuch-275.jpg (1/1)
  Augmenting [115/213] inventarbuch-250.jpg (1/1)
  Augmenting [116/213] inventarbuch-214.jpg (1/1)
  Augmenting [117/213] inventarbuch-213.jpg (1/1)
  Augmenting [118/213] inventarbuch-137.jpg (1/1)
  Augmenting [119/213] inventarbuch-215.jpg (1/1)
  Augmenting [120/213] inventarbuch-186.jpg (1/1)
  Augmenting [121/213] inventarbuch-216.jpg (1/1)
  Augmenting [122/213] inventarbuch-212.jpg (1/1)
  Augmenting [123/213] inventarbuch-102.jpg (1/1)
  Augmenting [124/213] inventarbuch-127.jpg (1/1)
  Augmenting [125/213] inventarbuch-210.jpg (1/1)
  Augmenting [126/213] inventarbuch-240.jpg (1/1)
  Augmenting [127/213] inventarbuch-219.jpg (1/1)
  Augmenting [128/213] inventarbuch-098.jpg (1/1)
  Augmenting [129/213] inventarbuch-257.jpg (1/1)
  Augmenting [130/213] inventarbuch-052.jpg (1/1)
  Augmenting [131/213] inventarbuch-139.jpg (1/1)
  Augmenting [132/213] inventarbuch-079.jpg (1/1)
  Augmenting [133/213] inventarbuch-029.jpg (1/1)
  Augmenting [134/213] inventarbuch-135.jpg (1/1)
  Augmenting [135/213] inventarbuch-047.jpg (1/1)
  Augmenting [136/213] inventarbuch-133.jpg (1/1)
  Augmenting [137/213] inventarbuch-284.jpg (1/1)
  Augmenting [138/213] inventarbuch-001.jpg (1/1)
  Augmenting [139/213] inventarbuch-233.jpg (1/1)
  Augmenting [140/213] inventarbuch-163.jpg (1/1)
  Augmenting [141/213] inventarbuch-295.jpg (1/1)
  Augmenting [142/213] inventarbuch-261.jpg (1/1)
  Augmenting [143/213] inventarbuch-165.jpg (1/1)
  Augmenting [144/213] inventarbuch-090.jpg (1/1)
  Augmenting [145/213] inventarbuch-198.jpg (1/1)
  Augmenting [146/213] inventarbuch-278.jpg (1/1)
  Augmenting [147/213] inventarbuch-031.jpg (1/1)
  Augmenting [148/213] inventarbuch-003.jpg (1/1)
  Augmenting [149/213] inventarbuch-262.jpg (1/1)
  Augmenting [150/213] inventarbuch-066.jpg (1/1)
  Augmenting [151/213] inventarbuch-271.jpg (1/1)
  Augmenting [152/213] inventarbuch-301.jpg (1/1)
  Augmenting [153/213] inventarbuch-211.jpg (1/1)
  Augmenting [154/213] inventarbuch-101.jpg (1/1)
  Augmenting [155/213] inventarbuch-196.jpg (1/1)
  Augmenting [156/213] inventarbuch-158.jpg (1/1)
  Augmenting [157/213] inventarbuch-112.jpg (1/1)
  Augmenting [158/213] inventarbuch-042.jpg (1/1)
  Augmenting [159/213] inventarbuch-041.jpg (1/1)
  Augmenting [160/213] inventarbuch-030.jpg (1/1)
  Augmenting [161/213] inventarbuch-307.jpg (1/1)
  Augmenting [162/213] inventarbuch-025.jpg (1/1)
  Augmenting [163/213] inventarbuch-131.jpg (1/1)
  Augmenting [164/213] inventarbuch-136.jpg (1/1)
  Augmenting [165/213] inventarbuch-205.jpg (1/1)
  Augmenting [166/213] inventarbuch-242.jpg (1/1)
  Augmenting [167/213] inventarbuch-251.jpg (1/1)
  Augmenting [168/213] inventarbuch-199.jpg (1/1)
  Augmenting [169/213] inventarbuch-177.jpg (1/1)
  Augmenting [170/213] inventarbuch-113.jpg (1/1)
  Augmenting [171/213] inventarbuch-155.jpg (1/1)
  Augmenting [172/213] inventarbuch-208.jpg (1/1)
  Augmenting [173/213] inventarbuch-268.jpg (1/1)
  Augmenting [174/213] inventarbuch-149.jpg (1/1)
  Augmenting [175/213] inventarbuch-065.jpg (1/1)
  Augmenting [176/213] inventarbuch-037.jpg (1/1)
  Augmenting [177/213] inventarbuch-069.jpg (1/1)
  Augmenting [178/213] inventarbuch-038.jpg (1/1)
  Augmenting [179/213] inventarbuch-122.jpg (1/1)
  Augmenting [180/213] inventarbuch-170.jpg (1/1)
  Augmenting [181/213] inventarbuch-291.jpg (1/1)
  Augmenting [182/213] inventarbuch-132.jpg (1/1)
  Augmenting [183/213] inventarbuch-174.jpg (1/1)
  Augmenting [184/213] inventarbuch-195.jpg (1/1)
  Augmenting [185/213] inventarbuch-200.jpg (1/1)
  Augmenting [186/213] inventarbuch-273.jpg (1/1)
  Augmenting [187/213] inventarbuch-151.jpg (1/1)
  Augmenting [188/213] inventarbuch-056.jpg (1/1)
  Augmenting [189/213] inventarbuch-298.jpg (1/1)
  Augmenting [190/213] inventarbuch-224.jpg (1/1)
  Augmenting [191/213] inventarbuch-105.jpg (1/1)
  Augmenting [192/213] inventarbuch-083.jpg (1/1)
  Augmenting [193/213] inventarbuch-010.jpg (1/1)
  Augmenting [194/213] inventarbuch-243.jpg (1/1)
  Augmenting [195/213] inventarbuch-016.jpg (1/1)
  Augmenting [196/213] inventarbuch-086.jpg (1/1)
  Augmenting [197/213] inventarbuch-182.jpg (1/1)
  Augmenting [198/213] inventarbuch-058.jpg (1/1)
  Augmenting [199/213] inventarbuch-282.jpg (1/1)
  Augmenting [200/213] inventarbuch-293.jpg (1/1)
  Augmenting [201/213] inventarbuch-169.jpg (1/1)
  Augmenting [202/213] inventarbuch-071.jpg (1/1)
  Augmenting [203/213] inventarbuch-255.jpg (1/1)
  Augmenting [204/213] inventarbuch-123.jpg (1/1)
  Augmenting [205/213] inventarbuch-254.jpg (1/1)
  Augmenting [206/213] inventarbuch-005.jpg (1/1)
  Augmenting [207/213] inventarbuch-077.jpg (1/1)
  Augmenting [208/213] inventarbuch-107.jpg (1/1)
  Augmenting [209/213] inventarbuch-121.jpg (1/1)
  Augmenting [210/213] inventarbuch-134.jpg (1/1)
  Augmenting [211/213] inventarbuch-173.jpg (1/1)
  Augmenting [212/213] inventarbuch-185.jpg (1/1)
  Augmenting [213/213] inventarbuch-197.jpg (1/1)
Training: 426 samples (original: 213, augmented: 213)
Validation/Test: 47 valid samples out of 47 total (no augmentation)
Training: 426 samples (with augmentation), Validation: 47 samples
GPU = NVIDIA A100-SXM4-40GB. Max memory = 39.494 GB.
4.809 GB of memory reserved.
Starting training with CER-based evaluation (A100-optimized, INVENTORY)...
{'loss': 79.8361, 'grad_norm': 604.5784912109375, 'learning_rate': 0.0, 'epoch': 0.04}
{'loss': 80.0892, 'grad_norm': 840.0026245117188, 'learning_rate': 1.2000000000000002e-06, 'epoch': 0.19}
{'loss': 79.1901, 'grad_norm': 586.9439086914062, 'learning_rate': 2.7e-06, 'epoch': 0.38}
{'loss': 69.8271, 'grad_norm': 397.9500427246094, 'learning_rate': 4.2000000000000004e-06, 'epoch': 0.56}
{'loss': 59.5174, 'grad_norm': 201.95767211914062, 'learning_rate': 5.7000000000000005e-06, 'epoch': 0.75}
{'loss': 51.4924, 'grad_norm': 227.7978973388672, 'learning_rate': 7.2e-06, 'epoch': 0.94}
{'eval_loss': 2.8662421703338623, 'eval_cer': 0.33626649905719674, 'eval_cer_percentage': 33.626649905719674, 'eval_runtime': 24.0008, 'eval_samples_per_second': 1.958, 'eval_steps_per_second': 1.958, 'epoch': 1.0}
{'loss': 42.0853, 'grad_norm': 98.27086639404297, 'learning_rate': 8.7e-06, 'epoch': 1.11}
{'loss': 40.6279, 'grad_norm': 88.0683822631836, 'learning_rate': 1.02e-05, 'epoch': 1.3}
{'loss': 35.9482, 'grad_norm': 127.56148529052734, 'learning_rate': 1.1700000000000001e-05, 'epoch': 1.49}
{'loss': 32.3115, 'grad_norm': 59.53943634033203, 'learning_rate': 1.32e-05, 'epoch': 1.68}
{'loss': 28.0427, 'grad_norm': 45.380733489990234, 'learning_rate': 1.47e-05, 'epoch': 1.86}
{'eval_loss': 1.648978590965271, 'eval_cer': 0.11502199874292897, 'eval_cer_percentage': 11.502199874292897, 'eval_runtime': 22.6485, 'eval_samples_per_second': 2.075, 'eval_steps_per_second': 2.075, 'epoch': 2.0}
{'loss': 24.2229, 'grad_norm': 48.729591369628906, 'learning_rate': 1.62e-05, 'epoch': 2.04}
{'loss': 25.4394, 'grad_norm': 30.54932975769043, 'learning_rate': 1.77e-05, 'epoch': 2.23}
{'loss': 24.9431, 'grad_norm': 29.926258087158203, 'learning_rate': 1.9200000000000003e-05, 'epoch': 2.41}
{'loss': 23.5163, 'grad_norm': 51.80682373046875, 'learning_rate': 2.07e-05, 'epoch': 2.6}
{'loss': 24.2846, 'grad_norm': 30.749004364013672, 'learning_rate': 2.22e-05, 'epoch': 2.79}
{'loss': 23.1334, 'grad_norm': 40.250335693359375, 'learning_rate': 2.37e-05, 'epoch': 2.98}
{'eval_loss': 1.4748356342315674, 'eval_cer': 0.1005656819610308, 'eval_cer_percentage': 10.05656819610308, 'eval_runtime': 22.5571, 'eval_samples_per_second': 2.084, 'eval_steps_per_second': 2.084, 'epoch': 3.0}
{'loss': 20.3931, 'grad_norm': 84.11016082763672, 'learning_rate': 2.52e-05, 'epoch': 3.15}
{'loss': 22.0079, 'grad_norm': 32.90016174316406, 'learning_rate': 2.6700000000000002e-05, 'epoch': 3.34}
{'loss': 22.4267, 'grad_norm': 24.77823829650879, 'learning_rate': 2.8199999999999998e-05, 'epoch': 3.53}
{'loss': 21.1061, 'grad_norm': 44.36903762817383, 'learning_rate': 2.97e-05, 'epoch': 3.71}
{'loss': 21.0989, 'grad_norm': 60.155784606933594, 'learning_rate': 2.9985919533659653e-05, 'epoch': 3.9}
{'eval_loss': 1.4394909143447876, 'eval_cer': 0.11125078566939033, 'eval_cer_percentage': 11.125078566939033, 'eval_runtime': 22.5991, 'eval_samples_per_second': 2.08, 'eval_steps_per_second': 2.08, 'epoch': 4.0}
{'loss': 19.4354, 'grad_norm': 29.54212188720703, 'learning_rate': 2.992876294154013e-05, 'epoch': 4.08}
{'loss': 20.1459, 'grad_norm': 29.04243278503418, 'learning_rate': 2.9827817715520775e-05, 'epoch': 4.26}
{'loss': 20.0678, 'grad_norm': 54.33901596069336, 'learning_rate': 2.968337994534213e-05, 'epoch': 4.45}
{'loss': 19.1154, 'grad_norm': 39.97332000732422, 'learning_rate': 2.9495873291870436e-05, 'epoch': 4.64}
{'loss': 19.1269, 'grad_norm': 31.049036026000977, 'learning_rate': 2.9265847744427305e-05, 'epoch': 4.83}
{'loss': 17.7128, 'grad_norm': 18.894363403320312, 'learning_rate': 2.8993978007576263e-05, 'epoch': 5.0}
{'eval_loss': 1.4600640535354614, 'eval_cer': 0.1181646763042112, 'eval_cer_percentage': 11.81646763042112, 'eval_runtime': 22.6721, 'eval_samples_per_second': 2.073, 'eval_steps_per_second': 2.073, 'epoch': 5.0}
{'loss': 18.5208, 'grad_norm': 406.4840393066406, 'learning_rate': 2.868106152209805e-05, 'epoch': 5.19}
{'loss': 17.8733, 'grad_norm': 61.96639633178711, 'learning_rate': 2.832801612595937e-05, 'epoch': 5.38}
{'loss': 17.5145, 'grad_norm': 78.33094787597656, 'learning_rate': 2.793587736213603e-05, 'epoch': 5.56}
{'loss': 17.2876, 'grad_norm': 40.05781173706055, 'learning_rate': 2.7505795441186953e-05, 'epoch': 5.75}
{'loss': 17.2089, 'grad_norm': 56.08517074584961, 'learning_rate': 2.703903186748843e-05, 'epoch': 5.94}
{'eval_loss': 1.519212007522583, 'eval_cer': 0.11879321181646763, 'eval_cer_percentage': 11.879321181646763, 'eval_runtime': 22.6228, 'eval_samples_per_second': 2.078, 'eval_steps_per_second': 2.078, 'epoch': 6.0}
{'train_runtime': 3929.2755, 'train_samples_per_second': 1.626, 'train_steps_per_second': 0.099, 'train_loss': 30.292210861488623, 'epoch': 6.0}
3929.2755 seconds used for training.
65.49 minutes used for training.
Peak reserved memory = 9.291 GB.
Peak reserved memory for training = 4.482 GB.
Peak reserved memory % of max memory = 23.525 %.
Peak reserved memory for training % of max memory = 11.349 %.

Saving model to /home/vault/iwi5/iwi5298h/models_image_text/gemma/inventory_dataset/run_A100_CER_20251117_143251...
Model (LoRA adapters) saved successfully!

============================================================
STARTING EVALUATION ON INVENTORY TEST.JSONL
============================================================
Starting evaluation on INVENTORY test.jsonl with aggressive chunking...
Loaded 48 test samples

============================================================
Chunk 1/10 (5 images)
============================================================

[1/48] Processing: inventarbuch-022.jpg
  ❌ Error: p.attn_bias_ptr is not correctly aligned

[2/48] Processing: inventarbuch-099.jpg
  ✅ CER: 0.1922 (19.22%)

[3/48] Processing: inventarbuch-245.jpg
  ✅ CER: 0.2418 (24.18%)

[4/48] Processing: inventarbuch-263.jpg
  ✅ CER: 0.1322 (13.22%)

[5/48] Processing: inventarbuch-033.jpg
  ✅ CER: 0.3408 (34.08%)

Chunk 1 completed. Cleaning memory...

============================================================
Chunk 2/10 (5 images)
============================================================

[6/48] Processing: inventarbuch-143.jpg
  ✅ CER: 0.1390 (13.90%)

[7/48] Processing: inventarbuch-244.jpg
  ✅ CER: 0.3714 (37.14%)

[8/48] Processing: inventarbuch-024.jpg
  ✅ CER: 0.0717 (7.17%)

[9/48] Processing: inventarbuch-141.jpg
  ✅ CER: 0.1246 (12.46%)

[10/48] Processing: inventarbuch-183.jpg
  ✅ CER: 0.5711 (57.11%)

Chunk 2 completed. Cleaning memory...

============================================================
Chunk 3/10 (5 images)
============================================================

[11/48] Processing: inventarbuch-191.jpg
  ✅ CER: 0.2420 (24.20%)

[12/48] Processing: inventarbuch-051.jpg
  ✅ CER: 0.1056 (10.56%)

[13/48] Processing: inventarbuch-203.jpg
  ✅ CER: 0.2736 (27.36%)

[14/48] Processing: inventarbuch-296.jpg
  ✅ CER: 0.2975 (29.75%)

[15/48] Processing: inventarbuch-302.jpg
  ✅ CER: 0.0705 (7.05%)

Chunk 3 completed. Cleaning memory...
Saved intermediate results to: /home/vault/iwi5/iwi5298h/models_image_text/gemma/inventory_dataset/run_A100_CER_20251117_143251/test_predictions_chunk_3.jsonl

============================================================
Chunk 4/10 (5 images)
============================================================

[16/48] Processing: inventarbuch-179.jpg
  ✅ CER: 0.2281 (22.81%)

[17/48] Processing: inventarbuch-114.jpg
  ✅ CER: 0.2578 (25.78%)

[18/48] Processing: inventarbuch-082.jpg
  ✅ CER: 0.3371 (33.71%)

[19/48] Processing: inventarbuch-287.jpg
  ✅ CER: 0.2993 (29.93%)

[20/48] Processing: inventarbuch-181.jpg
  ✅ CER: 0.2508 (25.08%)

Chunk 4 completed. Cleaning memory...

============================================================
Chunk 5/10 (5 images)
============================================================

[21/48] Processing: inventarbuch-299.jpg
  ✅ CER: 0.2264 (22.64%)

[22/48] Processing: inventarbuch-084.jpg
  ✅ CER: 0.4036 (40.36%)

[23/48] Processing: inventarbuch-004.jpg
  ✅ CER: 0.1807 (18.07%)

[24/48] Processing: inventarbuch-148.jpg
  ✅ CER: 0.0999 (9.99%)

[25/48] Processing: inventarbuch-238.jpg
  ✅ CER: 0.2541 (25.41%)

Chunk 5 completed. Cleaning memory...

============================================================
Chunk 6/10 (5 images)
============================================================

[26/48] Processing: inventarbuch-116.jpg
  ✅ CER: 0.1162 (11.62%)

[27/48] Processing: inventarbuch-223.jpg
  ✅ CER: 0.1582 (15.82%)

[28/48] Processing: inventarbuch-104.jpg
  ✅ CER: 0.2906 (29.06%)

[29/48] Processing: inventarbuch-015.jpg
  ✅ CER: 0.2913 (29.13%)

[30/48] Processing: inventarbuch-272.jpg
  ✅ CER: 0.2315 (23.15%)

Chunk 6 completed. Cleaning memory...
Saved intermediate results to: /home/vault/iwi5/iwi5298h/models_image_text/gemma/inventory_dataset/run_A100_CER_20251117_143251/test_predictions_chunk_6.jsonl

============================================================
Chunk 7/10 (5 images)
============================================================

[31/48] Processing: inventarbuch-124.jpg
  ✅ CER: 0.1585 (15.85%)

[32/48] Processing: inventarbuch-115.jpg
  ✅ CER: 0.9538 (95.38%)

[33/48] Processing: inventarbuch-049.jpg
  ✅ CER: 0.0433 (4.33%)

[34/48] Processing: inventarbuch-017.jpg
  ✅ CER: 0.0760 (7.60%)

[35/48] Processing: inventarbuch-018.jpg
  ✅ CER: 0.3361 (33.61%)

Chunk 7 completed. Cleaning memory...

============================================================
Chunk 8/10 (5 images)
============================================================

[36/48] Processing: inventarbuch-225.jpg
  ✅ CER: 0.2755 (27.55%)

[37/48] Processing: inventarbuch-046.jpg
  ✅ CER: 0.9365 (93.65%)

[38/48] Processing: inventarbuch-294.jpg
  ✅ CER: 0.1487 (14.87%)

[39/48] Processing: inventarbuch-054.jpg
  ✅ CER: 0.3394 (33.94%)

[40/48] Processing: inventarbuch-073.jpg
  ✅ CER: 0.3578 (35.78%)

Chunk 8 completed. Cleaning memory...

============================================================
Chunk 9/10 (5 images)
============================================================

[41/48] Processing: inventarbuch-118.jpg
  ✅ CER: 0.2020 (20.20%)

[42/48] Processing: inventarbuch-130.jpg
  ✅ CER: 0.1824 (18.24%)

[43/48] Processing: inventarbuch-146.jpg
  ✅ CER: 0.2479 (24.79%)

[44/48] Processing: inventarbuch-014.jpg
  ✅ CER: 0.3007 (30.07%)

[45/48] Processing: inventarbuch-059.jpg
  ✅ CER: 0.2578 (25.78%)

Chunk 9 completed. Cleaning memory...
Saved intermediate results to: /home/vault/iwi5/iwi5298h/models_image_text/gemma/inventory_dataset/run_A100_CER_20251117_143251/test_predictions_chunk_9.jsonl

============================================================
Chunk 10/10 (3 images)
============================================================

[46/48] Processing: inventarbuch-256.jpg
  ✅ CER: 0.2133 (21.33%)

[47/48] Processing: inventarbuch-260.jpg
  ✅ CER: 0.1662 (16.62%)

[48/48] Processing: inventarbuch-279.jpg
  ✅ CER: 0.3258 (32.58%)

Chunk 10 completed. Cleaning memory...
Saved intermediate results to: /home/vault/iwi5/iwi5298h/models_image_text/gemma/inventory_dataset/run_A100_CER_20251117_143251/test_predictions_chunk_10.jsonl

CER evaluation results saved to: /home/vault/iwi5/iwi5298h/models_image_text/gemma/inventory_dataset/run_A100_CER_20251117_143251/cer_evaluation_results.txt

🎉 Gemma-3 Inventory training completed!
All outputs saved to: /home/vault/iwi5/iwi5298h/models_image_text/gemma/inventory_dataset/run_A100_CER_20251117_143251

Final CER: 0.2775 (27.75%)
Cleaned up temporary directory: /tmp/1391819.tinygpu/inventory_gemma_aug_amfmzaqf
Gemma-3 training completed at: Mon Nov 17 04:14:43 PM CET 2025
=== JOB_STATISTICS ===
=== current date     : Mon Nov 17 04:14:43 PM CET 2025
= Job-ID             : 1391819 on tinygpu
= Job-Name           : inven_updated
= Job-Command        : /home/hpc/iwi5/iwi5298h/Uddipan-Thesis/jobfiles/job_gemma.sh
= Initial workdir    : /home/hpc/iwi5/iwi5298h/Uddipan-Thesis/jobfiles
= Queue/Partition    : a100
= Slurm account      : iwi5 with QOS=normal
= Requested resources:  for 1-00:00:00
= Elapsed runtime    : 01:42:18
= Total RAM usage    : 11.0 GiB of requested  GiB (%)   
= Node list          : tg097
= Subm/Elig/Start/End: 2025-11-17T14:32:23 / 2025-11-17T14:32:23 / 2025-11-17T14:32:25 / 2025-11-17T16:14:43
======================
=== Quota infos ======
    Path                 Used     SoftQ    HardQ    Gracetime  Filec    FileQ    FiHaQ    FileGrace    
    /home/hpc             102.4G   104.9G   209.7G        N/A  31,431      500K   1,000K        N/A    
    /home/woody           184.8G  1000.0G  1500.0G        N/A     847K   5,000K   7,500K        N/A    
    /home/vault           592.5G  1048.6G  2097.2G        N/A   5,939      200K     400K        N/A    
======================
=== GPU utilization ==
gpu_name, gpu_bus_id, pid, gpu_utilization [%], mem_utilization [%], max_memory_usage [MiB], time [ms]
NVIDIA A100-SXM4-40GB, 00000000:81:00.0, 3325946, 30 %, 8 %, 10056 MiB, 6131041 ms
